После аварии на Чернобыльской АЭС наибольшее количество радиоактивных осадков (примерно 60 %) выпало над территорией:	Белорусии
Страна, в которой законодательно запретили использование ядерной энергии для производства электроэнергии:	Новая Зеландия
Авария на Чернобыльской АЭС произошла на энергоблоке:	4
Город энергетиков, где жили сотрудники Чернобыльской атомной электростанции, называется:	Припять
Полная остановка работы Чернобыльской АЭС была осуществлена в ... году.	2000
Конструкция сооруженного в ноябре 1986 года саркофага над взорвавшимся реактором представляла собой:	достроенные стены реактора 
Сильнейшее землетрясение в Японии 11 марта 2011 года привело к аварии на атомной электростанции Фукусима. Потребовалась ли эвакуация населения, проживающего рядом с АЭС?	да
Увеличение концентрации химических, физических и биологических агентов сверх обычных значений в окружающей среде называется	загрязнением
Может ли газ озон считаться загрязнителем у поверхности земли?	да
Предельно допустимая концентрация (ПДК) загрязняющих веществ:	высокая концентрация, не вызывающая никаких патологических изменений 
Верно ли утверждение, что предельно допустимая концентрация (ПДК) загрязняющего вещества должна быть существенно ниже установленного в опытах уровня регистрируемого воздействия на организмы?	да
Наиболее чувствительным к воздействию загрязняющих веществ является организм на стадии:	эмбриогенеза
Биологическое загрязнение чаще всего происходит в результате поступления в водоемы	бытовых сточных вод 
Наибольшие объемы выбросов загрязняющих веществ в окружющую среду производят такие отрасли промышленности, как:	электроэнергетика
Как правило, в крупных городах России (пример - Москва) основным источником загрязнения атмосферного воздуха является:	автотранспорт
Кислотными осадками называются все виды метеорологических осадков - дождь, снег, туман, град, дождь со снегом, - рН которых меньше значения ...(укажите цифру и используйте точку вместо запятой для отделения десятичных значений)	5.6
Наиболее чувствительными к воздействию кислотных осадков являются:	хвойные деревья 
К отрицательным последствиям фотохимического смога относится:	осложнение бронхита и астмы 
Автомобили переводят на сжиженный газ, потому что:	снижается выброс углекислого газа по сравнению с бензиновыми двигателями 
Озоновый экран в стратосфере важен для живых организмов, так как выполняет функцию защиты от:	ультрафиолетового излучения 
Озоновый экран в стратосфере разрушается под воздействием:	хлорфторуглерода
По статистическим данным основной причиной заболеваемости и смертности людей является:	травматизм
Шумовое воздействие относится к виду загрязнения:	физическому
Вымывание кальция из организма животных и человека является следствием:	кислотных осдаков
Основным источником загрязнения почв свинцом являются:	автомобильный транспорт
Негативным последствием истощения озонового слоя Земли в стратосфере является:	повышение заболеваемости раком кожи 
Принятие Венской конвенции в 1985 году и последующее подписание в 1987 году Монреальского протокола были направлены на:	защиту озонового слоя
Вся совокупность мер, используемых для обеспечения долгосрочной экологической безопасности с учетом экономических возможностей и социальных потребностей общества, называется:	экологической политикой 
Экологический мониторинг как направление контроля за состоянием окружающей среды в нашей стране начал функционировать с:	начала 1970-х годов 
Экологический норматив качества окружающей среды, регламентирующий загрязняющие вещества в воздухе, называется:	ПДВ
Совокупность сведений - экономических, экологических, организационных и технических показателей о составе и категориях пользователей, количественном и качественном состоянии ресурсов и их оценке называется:	кадастром
Земли сельскохозяйственного назначения в структуре земельного фонда Российской Федерации в соответствии с данными государственного кадастра составляют чуть более... %.	20
Экологическая экспертиза относится к группе методов экологической политики, получивших название:	предупредительные
Федеральный закон - Об экологической экспертизе - был принят в России в ... году.	1995
Экологический аудит предприятия проводится по решению:	самого предприятия 
Международные стандарты ISO 14000 направлены на:	создание системы экологического менеджмента 
Ведущая роль в осуществлении государственного экологического контроля в РФ принадлежит:	Министерству природных ресурсов и экологии 
В иерархии экологических нормативных актов Российской Федерации главенструющая роль принадлежит:	Федеральным Законам 
Действующий в настоящее время в Российской Федерации закон - Об охране окружающей среды - был введен в действие в ... году.	2002
Основные поступления финансовых средств в экологические фонды РФ обеспечиваются платой за:	загрязнение окружающей среды 
Экологические штрафы, платежи, налоги и иные финансовые взыскания в системе экономического механизма управления природопользованием относятся к методам:	принудительынм
"Приоритетным направлением - Зеленой экономики - на ближайшее время является:
"	повышение энергоэффективности 
Верно ли утверждение, что экологическая экспертиза может быть двух видов - государственной и общественной?	да
Специальное изучение хозяйственных и технических проектов с целью установления их соответствия намечаемой хозяйственной деятельности экологическим требованиям, нормам и регламентам называется:	экологической экспертизой 
К экономическим методам регулирования природопользования относится:	платеж за пользование ресурсами 
Международные стандарты ISO 14000 для предприятий и различных организаций являются:	добровольными
К предупредительным мерам в системе экономического механизма управления природопользованием в Российской Федерации относятся:	кредиты
